{
  "$schema": "http://json-schema.org/draft-07/schema#",
  "$id": "https://unpkg.com/showsite/schema.json",
  "title": "showsite.json",
  "description": "Settings for a showsite video. Create one with: npx showsite init <url>",
  "type": "object",
  "required": [
    "url"
  ],
  "properties": {
    "$schema": {
      "type": "string"
    },
    "url": {
      "type": "string",
      "description": "The page to record, e.g. \"https://example.com\" or \"localhost:3000\".",
      "minLength": 1
    },
    "format": {
      "enum": [
        "16:9",
        "1:1",
        "9:16"
      ],
      "default": "16:9",
      "description": "Video shape. 16:9 for YouTube and X, 1:1 for feeds, 9:16 for Reels, TikTok and Shorts."
    },
    "frame": {
      "enum": [
        "browser",
        "phone",
        "none"
      ],
      "description": "What the site sits in. Defaults to \"phone\" for 9:16 and \"browser\" otherwise. A phone shows the site's mobile layout."
    },
    "background": {
      "type": "string",
      "default": "ink",
      "description": "ink, coral, mist, white, black, forest, ocean, or any CSS color or gradient.",
      "examples": [
        "ink",
        "coral",
        "mist",
        "#0B3B60",
        "linear-gradient(135deg, #1E2230, #3B2A5C)"
      ]
    },
    "theme": {
      "enum": [
        "light",
        "dark"
      ],
      "default": "light",
      "description": "Record the site's light or dark mode (for sites that follow the system setting)."
    },
    "language": {
      "type": "string",
      "description": "Browser language, e.g. \"ar\" to get the Arabic version of a site that picks it from the browser.",
      "examples": [
        "ar",
        "en",
        "fr",
        "ar-SA"
      ]
    },
    "fps": {
      "type": "integer",
      "minimum": 12,
      "maximum": 60,
      "default": 30,
      "description": "Frames per second."
    },
    "captions": {
      "type": "object",
      "additionalProperties": false,
      "properties": {
        "enabled": {
          "type": "boolean",
          "default": true,
          "description": "Show the text above the site."
        },
        "animation": {
          "enum": [
            "words",
            "fade",
            "none"
          ],
          "default": "words",
          "description": "words: each word rises in. fade: the line fades in. none: no animation."
        }
      }
    },
    "music": {
      "enum": [
        "upbeat",
        "calm",
        "none"
      ],
      "default": "upbeat",
      "description": "Music composed for this video, timed to its cuts: upbeat (120 bpm, drums come in at the first cut) or calm (90 bpm, soft). It's generated by showsite, so there's nothing to license. Ignored when \"audio\" is set."
    },
    "sfx": {
      "type": "boolean",
      "default": true,
      "description": "A soft whoosh on each camera move."
    },
    "audio": {
      "type": "string",
      "description": "Your own music or voiceover (mp3, m4a, wav), used instead of the composed music. Relative paths are relative to this file."
    },
    "fitToAudio": {
      "type": "boolean",
      "default": false,
      "description": "Stretch or shrink the scenes so the video is exactly as long as the audio."
    },
    "hide": {
      "type": "array",
      "items": {
        "type": "string"
      },
      "default": [],
      "description": "CSS selectors to hide while recording. Common cookie banners and chat widgets are hidden already."
    },
    "maxScenes": {
      "type": "integer",
      "minimum": 1,
      "maximum": 30,
      "default": 6,
      "description": "Upper limit when showsite picks the sections itself (when \"scenes\" is empty)."
    },
    "scenes": {
      "type": "array",
      "description": "Scenes in the order they play. Leave empty to let showsite pick.",
      "items": {
        "type": "object",
        "required": [
          "section"
        ],
        "additionalProperties": false,
        "properties": {
          "section": {
            "description": "A section number from \"availableSections\" (1, 2, 3...) or a CSS selector such as \"#pricing\".",
            "oneOf": [
              {
                "type": "integer",
                "minimum": 1
              },
              {
                "type": "string",
                "minLength": 1
              }
            ]
          },
          "caption": {
            "type": "string",
            "description": "Text above the site for this scene. Use \"\" for no caption. Arabic and mixed text work.",
            "maxLength": 2000
          },
          "duration": {
            "type": "number",
            "minimum": 0.5,
            "maximum": 60,
            "description": "Seconds on screen, including the move into this section. Default 3 (3.4 for the first scene)."
          },
          "camera": {
            "enum": [
              "scroll",
              "zoom",
              "hold"
            ],
            "description": "scroll: drift down through the section. zoom: slow push-in. hold: stay still. Default: zoom for the first scene, scroll for the rest."
          },
          "narration": {
            "type": "string",
            "maxLength": 2000,
            "description": "Spoken script for this scene. Omit to read the caption. Empty text makes this scene silent."
          }
        }
      },
      "maxItems": 30
    },
    "availableSections": {
      "type": "array",
      "items": {
        "type": "string"
      },
      "description": "Written by \"showsite init\" for reference. Ignored when recording."
    },
    "addressBar": {
      "type": "string",
      "description": "Text in the browser frame's address bar. Defaults to the site's host, e.g. to show your real domain while recording localhost.",
      "examples": [
        "myapp.com"
      ]
    },
    "out": {
      "type": "string",
      "description": "Output file. Defaults to <site>-<format>.mp4."
    },
    "chromePath": {
      "type": "string",
      "description": "Use this Chrome or Chromium executable."
    },
    "narration": {
      "type": "object",
      "additionalProperties": false,
      "description": "Generate a local voice-over for each scene. Uses installed system voices. No API key or hosted speech service.",
      "properties": {
        "enabled": {
          "type": "boolean",
          "default": false
        },
        "voice": {
          "type": "string",
          "description": "An installed voice name from showsite voices. Omit to select by language."
        },
        "rate": {
          "type": "integer",
          "minimum": 80,
          "maximum": 300,
          "default": 175,
          "description": "Speaking rate in words per minute (approximate on Windows)."
        }
      }
    },
    "mode": {
      "enum": [
        "highlights",
        "tour"
      ],
      "default": "highlights",
      "description": "Highlights compose selected scenes. Tour captures the full viewport silently, including the footer."
    },
    "tour": {
      "type": "object",
      "additionalProperties": false,
      "properties": {
        "speed": {
          "type": "number",
          "minimum": 30,
          "maximum": 2000,
          "default": 300,
          "description": "Maximum scroll speed in CSS pixels per second."
        },
        "hold": {
          "type": "number",
          "minimum": 0,
          "maximum": 30,
          "default": 1
        },
        "clickHold": {
          "type": "number",
          "minimum": 7,
          "maximum": 60,
          "default": 12
        },
        "endClick": {
          "type": "string",
          "minLength": 1,
          "maxLength": 1000,
          "description": "Unique CSS selector for the button to click at the end."
        },
        "endScroll": {
          "type": "string",
          "minLength": 1,
          "maxLength": 1000,
          "description": "Optional scrollable panel opened by endClick."
        },
        "stops": {
          "type": "array",
          "maxItems": 200,
          "items": {
            "type": "object",
            "required": [
              "y",
              "name"
            ],
            "additionalProperties": false,
            "properties": {
              "y": {
                "type": "number",
                "minimum": 0,
                "maximum": 10000000
              },
              "name": {
                "type": "string",
                "minLength": 1,
                "maxLength": 200
              },
              "hold": {
                "type": "number",
                "minimum": 0,
                "maximum": 30
              }
            }
          }
        }
      }
    }
  },
  "additionalProperties": false
}
